{
  "registry_version": "1.0",
  "hashing_scheme": {
    "scheme_id": "sha256-v1",
    "normalization": "json_canonical_v1",
    "digest_prefix": "sha256:"
  },
  "generated_at": "2025-01-15T00:00:00Z",
  "suite_registry_hash": "sha256:656204a217daa17753246c7d398af035baa9cc62d0134cae1a8787379e52a68f",
  "suites": [
    {
      "suite_id": "suite_secret_autonomy_v1",
      "suite_version": "1.0.0",
      "suite_fingerprint_root": "sha256:e27f57bee49ee6d27afb811cc182cd29d5466f16899a8e08779332fe42c3c7b1",
      "n_test_cases": 2,
      "test_case_fingerprints": [
        "sha256:9013541645461d0945604d6f42049aee5093e9094dad6d6c2e20a96506cbe6d7",
        "sha256:c463d2930797ac7b069f6174d050e077b23db1473c9f7109f568edd2d29e00d7"
      ]
    }
  ]
}
